{
  "schema_version": "h4l-t1-validation-v1",
  "status": "pending",
  "dataset": "atlas2020_4lep",
  "protocol_sha256": "0000000000000000000000000000000000000000000000000000000000000000",
  "evidence_id": null,
  "independent_reference": null,
  "correlation": "independent_process_bins",
  "auxiliary": "poisson_tau_gamma",
  "modifier": "shapesys",
  "pyhf_version": "0.7.6",
  "validation_summary": {
    "reviewed_by": null,
    "reviewed_at": null,
    "numerical_tests": []
  }
}
